Idea Name,,
"Make a wordpress blogging plugin that is fully autonomous. Makes draft posts, Optimizes them, informed by search console, over time goes back and updates old posts with new information, bits of text, internal linking. Uses GPT and Nano to make the text and the images. You could make this as a service and not even mention the fact that is wordpress. Just buy the domain for the customer, handle the hosting, create the content, promote the brand via that content domain. Could be also a notion board for internal documentation etc. Could also be a forward facing FAQ trained on the incoming customer requests. ",,
Shopify plugin that is fully autonomous from a SEO/product description perspective. Auto ecom SEO. ,,
Boss PDX should buy the wordpress autobot plugin from Bryan and Ad-Apt. Make the verticals in CT and in FL ,,
"YouTube channel which is just about ""Money Politics Religion"" ",,
Local service to provide picture archiving and updating/digitizing for elderly people. Helping deborah get all of that done. Organized by AI. Synced in the cloud. One single drive and a scanner hardware connected to local wifi. ,,
Text to AI video channel of my book via descript. ,,
"Invent a safety vest that is branded and better. For example instead of buying boss pdx hoodies and t shirts we should just keep buying ""vests"" that are branded and help construciton workers do things. ",,
"Make a ""next gen basketball"" app like thenx ",,
"Make a ""finance for lost boys"" app like thenx ",,
"Repurpose 99vines into a content website using Claude and AI tools to perfect all of that data. Vibe code the entire thing without any of the users. Just like say ""solar power rocks"" ",,
Make a lobster trap that can get you a 3d scan and API response of a roof size and slope. ,,
"Setting up AI for elderly people. Sell to people in their 40s and 50s to help aging parents with all their stuff. A set up fee, a monthly fee, a maintenance fee for changes/upgrades. Documents all their stuff. Old person jarvis. ",,
Setting up AI for law firms. One local mini. The safe and secure way. Local inference local cloud. Local backup. If 10 lawyers like Colleen work on contingency fee then how fast can they work v how many cases. Research. Org. prep work. All the paralegal functions. ,,
"The reverse spam defense bot that sucks away their time and traps them. It would detect those ""quick question"" type emails and then handle them on the side bringing them into the tar pit. ",,
"The product I should work on for myself, and for others, is the email cheat code. The big checks I have is because I write emails. All these people pay me for email. I need to train that bot, give it to other people. No one can know the ""Lucas"" email method yet I know it second hand and can give it to anyone, but shouldn't share it. I should rent it out locally on discord to other entrepreneurs. I can then also offer it as a course and or rent it. ""Email on autopilot for your brands, businesses and personal life"" is a massive product. Zero inbox. ",,
The boss pdx estimator app should be the soft estimate. Like the pre close real estate deal that the realtor and or seller/buyer want that price to negotiate with. ,,
"Hey equipment rental and tracking so that the average person can see on the map where all that metal is located. 90% of it I am sure is idle. The goal would be to activate that inventory and make it available to the DIY market. An airtag and basic listing for each machine would be sufficient to generate a website and ecosystem for this. The rentals are high ticket items. it could come with an operator as well. Think about the yacht charter industry, but for heavy gear and land clearing. Its actually a 3 part marketplace. People with the license and cert, people with machines, people with jobs, people who have trailers but do not have machines (towers). ",,
"Make an AI driven carwash where its only water. Jets only and articulating arms can use LiDAR to position themselves relative to the car's location. You could probably do the whole thing mechanically and just have the car drive through a series of ""wheels"" that would physically ad-apt to the shape of the car. Roll up with the app, get a rinse. Water only might skirt various regulations. ",,